URL,Version,Status,OIDs,Name,Title,Descriptino,Used
http://hl7.org/fhir/CodeSystem/administration-subpotent-reason,5.0.0,active,"2.16.840.1.113883.4.642.4.2001",AdministrationSubPotentReason,Administration SubPotent Reason,"This value set is provided as an example. The value set to instantiate this attribute should be drawn from a robust terminology code system that consists of or contains concepts to support the medication administration process.","ValueSet/administration-subpotent-reason"
http://hl7.org/fhir/CodeSystem/medication-admin-status,5.0.0,active,"2.16.840.1.113883.4.642.4.2000",MedicationAdministrationStatusCodes,MedicationAdministration Status Codes,"MedicationAdministration Status Codes","ValueSet/medication-admin-status"
http://hl7.org/fhir/CodeSystem/medication-dose-aid,5.0.0,active,"2.16.840.1.113883.4.642.4.2075",MedicationDoseAid,Medication dose aid,"Medication dose aid","ValueSet/medication-dose-aid"
http://hl7.org/fhir/CodeSystem/medication-ingredientstrength,5.0.0,active,"2.16.840.1.113883.4.642.4.2062",MedicationIngredientStrengthCodes,Medication Ingredient Strength Codes,"Medication Ingredient Strength Codes","ValueSet/medication-ingredientstrength"
http://hl7.org/fhir/CodeSystem/medication-intended-performer-role,5.0.0,active,"2.16.840.1.113883.4.642.4.2074",MedicationIntendedPerformerRole,Medication Intended Performer Role,"Medication Intended Performer Role","ValueSet/medication-intended-performer-role"
http://hl7.org/fhir/CodeSystem/medication-status,5.0.0,active,"2.16.840.1.113883.4.642.4.1380",MedicationStatusCodes,Medication Status Codes,"Medication Status Codes","ValueSet/medication-status"
http://hl7.org/fhir/CodeSystem/medicationrequest-intent,5.0.0,active,"2.16.840.1.113883.4.642.4.1378",MedicationRequestIntentCodes,MedicationRequest Intent Codes,"MedicationRequest Intent Codes","ValueSet/medicationrequest-intent"
http://hl7.org/fhir/CodeSystem/medicationrequest-status,5.0.0,active,"2.16.840.1.113883.4.642.4.1377",MedicationRequestStatusCodes,MedicationRequest Status Codes,"MedicationRequest Status Codes","ValueSet/medicationrequest-status"
http://hl7.org/fhir/action-cardinality-behavior,5.0.0,active,"2.16.840.1.113883.4.642.4.808,2.16.840.1.113883.4.642.1.791",ActionCardinalityBehavior,Action Cardinality Behavior,"Defines behavior for an action or a group for how many times that item may be repeated.","ValueSet/action-cardinality-behavior"
http://hl7.org/fhir/action-code,5.0.0,active,"2.16.840.1.113883.4.642.4.1944",ActionCode,Action Code,"Provides examples of actions to be performed.","ValueSet/action-code"
http://hl7.org/fhir/action-condition-kind,5.0.0,active,"2.16.840.1.113883.4.642.1.799,2.16.840.1.113883.4.642.4.816",ActionConditionKind,Action Condition Kind,"Defines the kinds of conditions that can appear on actions.","ValueSet/action-condition-kind"
http://hl7.org/fhir/action-grouping-behavior,5.0.0,active,"2.16.840.1.113883.4.642.4.800,2.16.840.1.113883.4.642.1.783",ActionGroupingBehavior,Action Grouping Behavior,"Defines organization behavior of a group.","ValueSet/action-grouping-behavior"
http://hl7.org/fhir/action-participant-function,5.0.0,active,"2.16.840.1.113883.4.642.4.1946",ActionParticipantFunction,Action Participant Function,"The function performed by the participant for the action.","ValueSet/action-participant-function"
http://hl7.org/fhir/action-participant-type,5.0.0,active,"2.16.840.1.113883.4.642.1.795,2.16.840.1.113883.4.642.4.812",ActionParticipantType,Action Participant Type,"The type of participant for the action.","ValueSet/action-participant-type"
http://hl7.org/fhir/action-precheck-behavior,5.0.0,active,"2.16.840.1.113883.4.642.1.789,2.16.840.1.113883.4.642.4.806",ActionPrecheckBehavior,Action Precheck Behavior,"Defines selection frequency behavior for an action or group.","ValueSet/action-precheck-behavior"
http://hl7.org/fhir/action-reason-code,5.0.0,active,"2.16.840.1.113883.4.642.4.1945",ActionReasonCode,Action Reason Code,"Provides examples of reasons for actions to be performed.","ValueSet/action-reason-code"
http://hl7.org/fhir/action-relationship-type,5.0.0,active,"2.16.840.1.113883.4.642.1.797,2.16.840.1.113883.4.642.4.814",ActionRelationshipType,Action Relationship Type,"Defines the types of relationships between actions.","ValueSet/action-relationship-type"
http://hl7.org/fhir/action-required-behavior,5.0.0,active,"2.16.840.1.113883.4.642.1.787,2.16.840.1.113883.4.642.4.804",ActionRequiredBehavior,Action Required Behavior,"Defines expectations around whether an action or action group is required.","ValueSet/action-required-behavior"
http://hl7.org/fhir/action-selection-behavior,5.0.0,active,"2.16.840.1.113883.4.642.1.785,2.16.840.1.113883.4.642.4.802",ActionSelectionBehavior,Action Selection Behavior,"Defines selection behavior of a group.","ValueSet/action-selection-behavior"
http://hl7.org/fhir/administrative-gender,5.0.0,active,"2.16.840.1.113883.4.642.4.2",AdministrativeGender,AdministrativeGender,"The gender of a person used for administrative purposes.","ValueSet/administrative-gender"
http://hl7.org/fhir/days-of-week,5.0.0,active,"2.16.840.1.113883.4.642.4.513,2.16.840.1.113883.4.642.2.302,2.16.840.1.113883.4.642.1.507",DaysOfWeek,Days Of Week,"The days of the week.","ValueSet/days-of-week"
http://hl7.org/fhir/device-correctiveactionscope,5.0.0,active,"2.16.840.1.113883.4.642.4.1932",DeviceCorrectiveActionScope,Device Corrective Action Scope,"The type of relation between devices.","ValueSet/device-correctiveactionscope"
http://hl7.org/fhir/device-nametype,5.0.0,active,"2.16.840.1.113883.4.642.4.1084",DeviceNameType,Device Name Type,"The type of name the device is referred by.","ValueSet/device-nametype"
http://hl7.org/fhir/device-productidentifierinudi,5.0.0,active,,DeviceProductionIdentifierInUDI,Device Production Identifier In UDI,"The production identifier(s) that are expected to appear in the UDI carrier.","ValueSet/device-productidentifierinudi"
http://hl7.org/fhir/device-specification-category,5.0.0,active,"2.16.840.1.113883.4.642.4.2054",FHIRDeviceSpecializationCategory,FHIR Device Specialization Category,"The kind of standards used by the device.","ValueSet/device-specification-category"
http://hl7.org/fhir/devicedefinition-regulatory-identifier-type,5.0.0,active,"2.16.840.1.113883.4.642.4.2109",DeviceRegulatoryIdentifierType,Device Regulatory Identifier Type,"The type of regulatory identifier.","ValueSet/devicedefinition-regulatory-identifier-type"
http://hl7.org/fhir/devicedefinition-relationtype,5.0.0,active,"2.16.840.1.113883.4.642.4.1933",DeviceDefinitionRelationType,Device Definition Relation Type,"The type of relation between devices.","ValueSet/devicedefinition-relationtype"
http://hl7.org/fhir/encounter-diagnosis-use,5.0.0,active,"2.16.840.1.113883.4.642.4.2115",EncounterDiagnosisUse,Encounter Diagnosis Use,"Encounter Condition Use","ValueSet/encounter-diagnosis-use"
http://hl7.org/fhir/encounter-location-status,5.0.0,active,"2.16.840.1.113883.4.642.1.258,2.16.840.1.113883.4.642.2.147,2.16.840.1.113883.4.642.4.263",EncounterLocationStatus,Encounter Location Status,"The status of the location.","ValueSet/encounter-location-status"
http://hl7.org/fhir/encounter-reason-use,5.0.0,active,"2.16.840.1.113883.4.642.4.2114",EncounterReasonUse,Encounter Reason Use,"Encounter Reason Use","ValueSet/encounter-reason-use"
http://hl7.org/fhir/encounter-status,5.0.0,active,"2.16.840.1.113883.4.642.4.247,2.16.840.1.113883.4.642.1.242",EncounterStatus,Encounter Status,"Current state of the encounter.","ValueSet/encounter-status"
http://hl7.org/fhir/event-timing,5.0.0,active,"2.16.840.1.113883.4.642.1.76",EventTiming,EventTiming,"Real-world event relating to the schedule.","ValueSet/event-timing"
http://hl7.org/fhir/fhir-types,5.0.0,active,"2.16.840.1.113883.4.642.4.1802",FHIRTypes,All FHIR Types,"One of the types defined as part of this version of FHIR.","ValueSet/participant-resource-types,ValueSet/resource-types"
http://hl7.org/fhir/identifier-use,5.0.0,active,"2.16.840.1.113883.4.642.1.58",IdentifierUse,IdentifierUse,"Identifies the purpose for this identifier, if known .","ValueSet/identifier-use"
http://hl7.org/fhir/link-type,5.0.0,active,"2.16.840.1.113883.4.642.1.413,2.16.840.1.113883.4.642.2.234,2.16.840.1.113883.4.642.4.424",LinkType,Link Type,"The type of link between this Patient resource and other Patient/RelatedPerson resource(s).","ValueSet/link-type"
http://hl7.org/fhir/location-characteristic,5.0.0,active,"2.16.840.1.113883.4.642.4.1970",LocationCharacteristic,Location Characteristic,"Example Set of Location Characteristics.","ValueSet/location-characteristic"
http://hl7.org/fhir/location-mode,5.0.0,active,"2.16.840.1.113883.4.642.4.331,2.16.840.1.113883.4.642.1.322,2.16.840.1.113883.4.642.2.181",LocationMode,Location Mode,"Indicates whether a resource instance represents a specific location or a class of locations.","ValueSet/location-mode"
http://hl7.org/fhir/location-status,5.0.0,active,"2.16.840.1.113883.4.642.4.333,2.16.840.1.113883.4.642.1.324,2.16.840.1.113883.4.642.2.182",LocationStatus,Location Status,"Indicates whether the location is still in use.","ValueSet/location-status"
http://hl7.org/fhir/name-use,5.0.0,active,"2.16.840.1.113883.4.642.4.66",NameUse,NameUse,"The use of a human name.","ValueSet/name-use"
http://hl7.org/fhir/observation-referencerange-normalvalue,5.0.0,active,"2.16.840.1.113883.4.642.4.2099",ObservationReferenceRangeNormalValue,ObservationreferenceRangeNormalValue,"Codes that describe the normal value in the reference range.","ValueSet/observation-referencerange-normalvalue"
http://hl7.org/fhir/observation-status,5.0.0,active,"2.16.840.1.113883.4.642.4.401,2.16.840.1.113883.4.642.1.388,2.16.840.1.113883.4.642.2.219",ObservationStatus,Observation Status,"Codes providing the status of an observation.","ValueSet/observation-status"
http://hl7.org/fhir/observation-triggeredbytype,5.0.0,active,"2.16.840.1.113883.4.642.4.2098",TriggeredBytype,triggered Bytype,"Codes providing the triggeredBy type of observation.","ValueSet/observation-triggeredbytype"
http://hl7.org/fhir/publication-status,5.0.0,active,"2.16.840.1.113883.4.642.4.4",PublicationStatus,PublicationStatus,"The lifecycle status of an artifact.","ValueSet/publication-status"
http://hl7.org/fhir/quantity-comparator,5.0.0,active,"2.16.840.1.113883.4.642.4.60",QuantityComparator,QuantityComparator,"How the Quantity should be understood and represented.","ValueSet/quantity-comparator"
http://hl7.org/fhir/request-intent,5.0.0,draft,"2.16.840.1.113883.4.642.4.114",RequestIntent,RequestIntent,"Codes indicating the degree of authority/intentionality associated with a request.","ValueSet/care-plan-intent"
http://hl7.org/fhir/request-priority,5.0.0,draft,"2.16.840.1.113883.4.642.4.116",RequestPriority,RequestPriority,"Identifies the level of importance to be assigned to actioning the request.","ValueSet/request-priority"
http://hl7.org/fhir/request-status,5.0.0,draft,"2.16.840.1.113883.4.642.4.112",RequestStatus,RequestStatus,"Codes identifying the lifecycle stage of a request.","ValueSet/request-status"
http://hl7.org/fhir/version-algorithm,5.0.0,active,"2.16.840.1.113883.4.642.4.1989",VersionAlgorithm,Version Algorithm,"Indicates the mechanism used to compare versions to determine which is more current.","ValueSet/version-algorithm"
http://loinc.org,3.1.0,active,"2.16.840.1.113883.6.1",LOINC,Logical Observation Identifiers, Names and Codes (LOINC),"LOINC provides a set of universal names and ID codes for identifying laboratory and clinical test results.1,2 LOINC facilitates the exchange and pooling of results, such as blood hemoglobin, serum potassium, or vital signs, for clinical care, outcomes management, and research. LOINC's universal identifiers (names and codes) can be used in the context of order and observation exchanges between information systems that use syntax standards such as HL73, CEN TC251, ISO TC215, ASTM4, and DICOM. Specifically, the identifier can be used as the coded value for an observation in any other standard that uses the observation/observation value paradigm, whether messages, documents, application programming interface (API), etc. For example, LOINC codes are used widely in the OBX segment Observation Identifier field (OBX-3) of an ORU HL7 (HL7 version 2.x or ASTM 1238-9410) message that may be sent between a Clinical Laboratory Information Management Systems (LIMS) and Electronic Health Record Systems (EHR).5, 6 In this way, LOINC codes provide universal identifiers that allow the exchange of clinical data between heterogeneous computing environments.","ValueSet/observation-codes"
http://ltsi.univ-rennes.fr/CodeSystem/CSCommunicationModes,0.1.0,draft,,CSCommunicationModes,Communication modes,"CodeSystem for french communication modes (incremental, summary).","ValueSet/vsCommunicationModes"
http://ltsi.univ-rennes.fr/CodeSystem/CSLOINC,0.1.0,draft,,CSLOINC,LOINC codes,"LOINC CodeSystem.","ValueSet/vsLOINC"
http://ltsi.univ-rennes.fr/CodeSystem/CSMedicalUnits,0.1.0,draft,,CSMedicalUnits,Medical units,"CodeSystem for french medical units (accommodation, medical liability unit).","ValueSet/vsMedicalUnits"
http://ltsi.univ-rennes.fr/CodeSystem/CSMedicationTypes,0.1.0,draft,,CSMedicationTypes,Medication types,"CodeSystem for french medication types.","ValueSet/vsMedicationTypes"
http://ltsi.univ-rennes.fr/CodeSystem/CSMedications,0.1.0,draft,,CSMedications,Medications,"CodeSystem for french medications.","ValueSet/vsMedications"
http://ltsi.univ-rennes.fr/CodeSystem/CSPrescriptionStatus,0.1.0,draft,,CSPrescriptionStatus,Prescription status,"CodeSystem for french prescription status (creation, stop, modification, validation).","ValueSet/vsPrescriptionStatus"
http://ltsi.univ-rennes.fr/CodeSystem/CSSCT,0.1.0,draft,,CSSCT,SNOMED CT Codes,"SNOMED CT code system.","ValueSet/vsSCT"
http://terminology.hl7.org/CodeSystem/action-type,0.1.0,draft,"2.16.840.1.113883.4.642.1.1246",ActionType,ActionType,"The type of action to be performed.","ValueSet/action-type"
http://terminology.hl7.org/CodeSystem/admit-source,0.1.0,draft,"2.16.840.1.113883.4.642.1.1092",AdmitSource,Admit source,"This value set defines a set of codes that can be used to indicate from where the patient came in.","ValueSet/encounter-admit-source"
http://terminology.hl7.org/CodeSystem/data-absent-reason,0.1.0,active,"2.16.840.1.113883.4.642.4.1048",DataAbsentReason,DataAbsentReason,"Used to specify why the normally expected content of the data element is missing.","ValueSet/data-absent-reason"
http://terminology.hl7.org/CodeSystem/definition-topic,0.1.0,draft,"2.16.840.1.113883.4.642.1.1244",DefinitionTopic,DefinitionTopic,"High-level categorization of the definition, used for searching, sorting, and filtering.","ValueSet/definition-topic"
http://terminology.hl7.org/CodeSystem/diet,0.1.0,draft,"2.16.840.1.113883.4.642.1.1091",Diet,Diet,"This value set defines a set of codes that can be used to indicate dietary preferences or restrictions a patient may have.","ValueSet/encounter-diet"
http://terminology.hl7.org/CodeSystem/discharge-disposition,0.1.0,draft,"2.16.840.1.113883.4.642.1.1093",DischargeDisposition,Discharge disposition,"This value set defines a set of codes that can be used to where the patient left the hospital.","ValueSet/encounter-discharge-disposition"
http://terminology.hl7.org/CodeSystem/dose-rate-type,0.1.0,draft,"2.16.840.1.113883.4.642.1.1069",DoseAndRateType,DoseAndRateType,"The kind of dose or rate specified.","ValueSet/dose-rate-type"
http://terminology.hl7.org/CodeSystem/encounter-special-arrangements,0.1.0,draft,"2.16.840.1.113883.4.642.1.1090",SpecialArrangements,Special arrangements,"This value set defines a set of codes that can be used to indicate the kinds of special arrangements in place for a patients visit.","ValueSet/encounter-special-arrangements"
http://terminology.hl7.org/CodeSystem/encounter-subject-status,1.0.0,draft,"2.16.840.1.113883.4.642.1.1420",EncounterSubjectStatus,Encounter subject status,"This example value set defines a set of codes that can be used to indicate the status of the subject within the encounter","ValueSet/encounter-subject-status"
http://terminology.hl7.org/CodeSystem/encounter-type,0.1.0,draft,"2.16.840.1.113883.4.642.1.1088",EncounterType,Encounter type,"This example value set defines a set of codes that can be used to indicate the type of encounter: a specific code indicating type of service provided.","ValueSet/encounter-type"
http://terminology.hl7.org/CodeSystem/goal-category,0.1.0,draft,"2.16.840.1.113883.4.642.1.1097",GoalCategory,Goal category,"Example codes for grouping goals to use for filtering or presentation.","ValueSet/goal-category"
http://terminology.hl7.org/CodeSystem/goal-priority,0.1.0,draft,"2.16.840.1.113883.4.642.1.1096",GoalPriority,Goal priority,"Indicates the level of importance associated with reaching or sustaining a goal.","ValueSet/goal-priority"
http://terminology.hl7.org/CodeSystem/location-physical-type,1.0.0,draft,"2.16.840.1.113883.4.642.1.1108",LocationType,Location type,"This example value set defines a set of codes that can be used to indicate the physical form of the Location.  This includes several 'non physical' codes which are still considered a location.","ValueSet/location-form"
http://terminology.hl7.org/CodeSystem/med-admin-perform-function,0.1.0,draft,"2.16.840.1.113883.4.642.1.1112",MedicationAdministrationPerformerFunctionCodes,MedicationAdministration Performer Function Codes,"MedicationAdministration Performer Function Codes","ValueSet/med-admin-perform-function"
http://terminology.hl7.org/CodeSystem/medication-admin-location,0.1.0,draft,"2.16.840.1.113883.4.642.1.0",MedicationAdministrationLocationCodes,MedicationAdministration Location Codes,"MedicationAdministration Location Codes","ValueSet/medication-admin-location"
http://terminology.hl7.org/CodeSystem/medicationrequest-admin-location,0.1.0,draft,"2.16.840.1.113883.4.642.1.0",MedicationRequest_Administration_Location_Codes,Medication request  administration  location  codes,"MedicationRequest Administration Location Codes","ValueSet/medicationrequest-admin-location"
http://terminology.hl7.org/CodeSystem/medicationrequest-course-of-therapy,0.1.0,draft,"2.16.840.1.113883.4.642.1.1327",MedicationRequestCourseOfTherapyCodes,MedicationRequest Course of Therapy Codes,"MedicationRequest Course of Therapy Codes","ValueSet/medicationrequest-course-of-therapy"
http://terminology.hl7.org/CodeSystem/medicationrequest-status-reason,0.1.0,draft,"2.16.840.1.113883.4.642.1.1325",MedicationRequestStatusReasonCodes,MedicationRequest Status Reason Codes,"MedicationRequest Status Reason Codes","ValueSet/medicationrequest-status-reason"
http://terminology.hl7.org/CodeSystem/observation-category,0.1.0,draft,"2.16.840.1.113883.4.642.1.1125",ObservationCategoryCodes,Observation Category Codes,"Observation Category codes.","ValueSet/observation-category"
http://terminology.hl7.org/CodeSystem/organization-type,0.1.0,draft,"2.16.840.1.113883.4.642.1.1128",OrganizationType,Organization type,"This example value set defines a set of codes that can be used to indicate a type of organization.","ValueSet/organization-type"
http://terminology.hl7.org/CodeSystem/participant-type,0.5.0,draft,"2.16.840.1.113883.4.642.1.1089",ParticipantType,Participant type,"This value set defines a set of codes that can be used to indicate how an individual participates in an encounter.","ValueSet/encounter-participant-type"
http://terminology.hl7.org/CodeSystem/reason-medication-given,0.1.0,draft,"2.16.840.1.113883.4.642.1.1110",ReasonMedicationGivenCodes,Reason Medication Given Codes,"This value set is provided as an example. The value set to instantiate this attribute should be drawn from a robust terminology code system that consists of or contains concepts to support the medication process.","ValueSet/reason-medication-given-codes"
http://terminology.hl7.org/CodeSystem/referencerange-meaning,0.1.0,draft,"2.16.840.1.113883.4.642.1.1124",ObservationReferenceRangeMeaningCodes,Observation Reference Range Meaning Codes,"This value set defines a set of codes that can be used to indicate the meaning/use of a reference range for a particular target population.","ValueSet/referencerange-meaning"
http://terminology.hl7.org/CodeSystem/service-type,0.1.0,draft,"2.16.840.1.113883.4.642.1.1145",ServiceType,Service type,"This value set defines an example set of codes of service-types.","ValueSet/service-type"
http://terminology.hl7.org/CodeSystem/timing-abbreviation,5.0.0,draft,,TimingAbbreviation,TimingAbbreviation,"Code for a known / defined timing pattern.","ValueSet/timing-abbreviation"
http://terminology.hl7.org/CodeSystem/v2-0092,2.1.0,active,"2.16.840.1.113883.18.36",ReAdmissionIndicator,re-admissionIndicator,"Code system of concepts which are used to specify that a patient is being re admitted to a healthcare facilityin from which they were discharged, and indicates the circumstances around such re-admission.  Used in HL7 Version 2.x messagine in the PV1 segment.","ValueSet/v2-0092"
http://terminology.hl7.org/CodeSystem/v2-0116,2.2.0,active,"2.16.840.1.113883.18.47",BedStatus,bedStatus,"Code system of concepts which specify the state of a bed in an inpatient setting, and is used to determine if a patient may be assigned to it or not.  Used in HL7 Version 2.x messaging in the DLD and PV1 segments.","ValueSet/v2-0116"
http://terminology.hl7.org/CodeSystem/v2-0131,2.1.0,active,"2.16.840.1.113883.18.58",ContactRole2,contactRole2,"Code system of concepts which specify a relationship role that the next of kin/associated parties plays with regard to the patient. Also used in referrals, for example, it may be necessary to identify the contact representative at the clinic that sent a referral. Used in HL7 Version 2 messaging in the NK1 and CTD segments after 2.5, when it replace 2.16.840.1.113883.18.57.","ValueSet/patient-contactrelationship"
http://terminology.hl7.org/CodeSystem/v2-0203,3.0.0,active,"2.16.840.1.113883.18.108",IdentifierType,identifierType,"HL7-defined code system of concepts specifying type of identifier. Used in HL7 Version 2.x messaging data types CX, PLN, PPN, XCN and XON.","ValueSet/identifier-type"
http://terminology.hl7.org/CodeSystem/v2-0360,2.1.0,active,"2.16.840.1.113883.18.220",DegreeLicenseCertificate,degreeLicenseCertificate,"Code system of concepts specifying an educational degree (e.g., MD).  Used in the CNN datatype (names and identifiers of clinicians) in Version 2 messaging.  Used in HL7 Version 2.x messaging in the CNN segment; note that in releases of HL7 prior to 2.3.1, was also used in person names (XPN), but this use was deprecated, then withdrawn in 2.7.","ValueSet/v2-0360"
http://terminology.hl7.org/CodeSystem/v3-ActCode,8.0.1,active,"2.16.840.1.113883.5.4",ActCode,ActCode,"A code specifying the particular kind of Act that the Act-instance represents within its class.    *Constraints:* The kind of Act (e.g. physical examination, serum potassium, inpatient encounter, charge financial transaction, etc.) is specified with a code from one of several, typically external, coding systems. The coding system will depend on the class of Act, such as LOINC for observations, etc.    Conceptually, the Act.code must be a specialization of the Act.classCode. This is why the structure of ActClass domain should be reflected in the superstructure of the ActCode domain and then individual codes or externally referenced vocabularies subordinated under these domains that reflect the ActClass structure.    Act.classCode and Act.code are not modifiers of each other but the Act.code concept should really imply the Act.classCode concept. For a negative example, it is not appropriate to use an Act.code ""potassium"" together with and Act.classCode for ""laboratory observation"" to somehow mean ""potassium laboratory observation"" and then use the same Act.code for ""potassium"" together with Act.classCode for ""medication"" to mean ""substitution of potassium"". This mutually modifying use of Act.code and Act.classCode is not permitted.","ValueSet/encounter-class"
http://terminology.hl7.org/CodeSystem/v3-ActPriority,2.1.0,active,"2.16.840.1.113883.5.7",ActPriority,ActPriority,"A set of codes (e.g., for routine, emergency), specifying the urgency under which the Act happened, can happen, is happening, is intended to happen, or is requested/demanded to happen.","ValueSet/v3-ActPriority"
http://terminology.hl7.org/CodeSystem/v3-ActReason,2.1.1,active,"2.16.840.1.113883.5.8",ActReason,ActReason,"A set of codes specifying the motivation, cause, or rationale of an Act, when such rationale is not reasonably represented as an ActRelationship of type ""has reason"" linking to another Act.    *Examples:* Example reasons that might qualify for being coded in this field might be: ""routine requirement"", ""infectious disease reporting requirement"", ""on patient request"", ""required by law"".","ValueSet/v3-SubstanceAdminSubstitutionReason"
http://terminology.hl7.org/CodeSystem/v3-EncounterSpecialCourtesy,2.1.0,active,"2.16.840.1.113883.5.40",EncounterSpecialCourtesy,EncounterSpecialCourtesy,"**** MISSING DESCRIPTION ****","ValueSet/encounter-special-courtesy"
http://terminology.hl7.org/CodeSystem/v3-GTSAbbreviation,2.1.0,active,"2.16.840.1.113883.5.1022",GTSAbbreviation,GTSAbbreviation,"*Open Issue:* It appears that the printnames are suboptimal and should be improved for many of the existing codes.","ValueSet/timing-abbreviation"
