URL,Version,Status,OIDs,Name,Title,Descriptino,Used
http://terminology.hl7.org/CodeSystem/v3-MaritalStatus,2.1.0,active,"2.16.840.1.113883.5.2",MaritalStatus,MaritalStatus,"\* \* \* No description supplied \* \* \*    *Open Issue:* The specific meanings of these codes can vary somewhat by jurisdiction and implementation so caution should be used when determining equivalency.    *Open Issue:* fixing and completion of the hierarchy and proper good definitions of all the concepts is badly needed.","ValueSet/marital-status"
http://terminology.hl7.org/CodeSystem/v3-NullFlavor,2.1.0,active,"2.16.840.1.113883.5.1008",NullFlavor,NullFlavor,"A collection of codes specifying why a valid value is not present.","ValueSet/marital-status,ValueSet/encounter-special-courtesy"
http://terminology.hl7.org/CodeSystem/v3-ObservationInterpretation,2.1.0,active,"2.16.840.1.113883.5.83",ObservationInterpretation,ObservationInterpretation,"One or more codes providing a rough qualitative interpretation of the observation, such as ""normal"" / ""abnormal"", ""low"" / ""high"", ""better"" / ""worse"", ""resistant"" / ""susceptible"", ""expected"" / ""not expected"". The value set is intended to be for ANY use where coded representation of an interpretation is needed.","ValueSet/observation-interpretation"
http://terminology.hl7.org/CodeSystem/v3-ParticipationType,4.0.0,active,"2.16.840.1.113883.5.90",ParticipationType,ParticipationType,"A code specifying the meaning and purpose of every Participation instance. Each of its values implies specific constraints on the Roles undertaking the participation.","ValueSet/encounter-participant-type"
http://terminology.hl7.org/CodeSystem/v3-RoleCode,2.2.0,active,"2.16.840.1.113883.5.111",RoleCode,RoleCode,"A set of codes further specifying the kind of Role; specific classification codes for further qualifying RoleClass codes.","ValueSet/v3-ServiceDeliveryLocationRoleType"
http://terminology.hl7.org/CodeSystem/v3-TimingEvent,2.1.0,active,"2.16.840.1.113883.5.139",TimingEvent,TimingEvent,"**** MISSING DESCRIPTION ****","ValueSet/event-timing"
http://terminology.hl7.org/CodeSystem/v3-substanceAdminSubstitution,2.1.0,active,"2.16.840.1.113883.5.1070",SubstanceAdminSubstitution,Substance Admin Substitution,"Identifies what sort of change is permitted or has occurred between the therapy that was ordered and the therapy that was/will be provided.","ValueSet/v3-ActSubstanceAdminSubstitutionCode"
http://unitsofmeasure.org,3.0.1,active,"2.16.840.1.113883.6.8",UCUM,Unified Code for Units of Measure (UCUM),"The Unified Code for Units of Measure (UCUM) is a code system intended to include all units of measures being contemporarily used in international science, engineering, and business. The purpose is to facilitate unambiguous electronic communication of quantities together with their units. The focus is on electronic communication, as opposed to communication between humans. A typical application of The Unified Code for Units of Measure are electronic data interchange (EDI) protocols, but there is nothing that prevents it from being used in other types of machine communication.","ValueSet/units-of-time"
urn:ietf:bcp:47,2.0.1,active,"2.16.840.1.113883.6.121",Ietf3066,Tags for the Identification of Languages,"Older value from OID registry.  Superceded; see recommendations in BCP-47.","ValueSet/languages,ValueSet/all-languages"
urn:iso:std:iso:11073:10101,2.0.1,active,"2.16.840.1.113883.6.24",Mdc,ISO 11073-10101 Health informatics - Point-of-care,"The nomenclature relates primarily to vital signs monitoring, but also includes semantics of other medical devices that are commonly used in acute care settings. There are multiple coding partitions each of which has a systematic name consisting of a set of base concepts and differentiating criteria.","ValueSet/device-type,ValueSet/device-property-type,ValueSet/device-specification-type"
urn:iso:std:iso:3166,1.0.0,active,"1.0.3166.1",ISO3166Part1,ISO 3166-1 Codes for the representation of names of countries and their subdivisions — Part 1: Country code,"ISO 3166-1 establishes codes that represent the current names of countries, dependencies, and other areas of particular geopolitical interest, on the basis of country names obtained from the United Nations.","ValueSet/jurisdiction"
urn:iso:std:iso:3166:-2,2013-11,retired,"1.0.3166.2",Iso3166_2,ISO 3166 Part 2 Country Subdivision Codes,"Identifies the coding system published in the ISO 3166-2 Standard for Country Subdivision codes. This standard is released periodically, and a new OID will be assigned by ISO for new editions.","ValueSet/jurisdiction"
