URL,Version,Status,OIDs,Name,Title,Descriptino,Uses,Used,Sources
http://hl7.org/fhir/ValueSet/action-cardinality-behavior,5.0.0,draft,"2.16.840.1.113883.4.642.3.807,2.16.840.1.113883.4.642.3.790",ActionCardinalityBehavior,Action Cardinality Behavior,"Defines behavior for an action or a group for how many times that item may be repeated.","StructureDefinition/protocol","hl7.fhir.r5.core"
http://hl7.org/fhir/ValueSet/action-code,5.0.0,draft,"2.16.840.1.113883.4.642.3.3051",ActionCode,Action Code,"Provides examples of actions to be performed.","StructureDefinition/protocol","hl7.fhir.r5.core"
http://hl7.org/fhir/ValueSet/action-condition-kind,5.0.0,draft,"2.16.840.1.113883.4.642.3.798,2.16.840.1.113883.4.642.3.815",ActionConditionKind,Action Condition Kind,"Defines the kinds of conditions that can appear on actions.","StructureDefinition/protocol","hl7.fhir.r5.core"
http://hl7.org/fhir/ValueSet/action-grouping-behavior,5.0.0,draft,"2.16.840.1.113883.4.642.3.782,2.16.840.1.113883.4.642.3.799",ActionGroupingBehavior,Action Grouping Behavior,"Defines organization behavior of a group.","StructureDefinition/protocol","hl7.fhir.r5.core"
http://hl7.org/fhir/ValueSet/action-participant-function,5.0.0,draft,"2.16.840.1.113883.4.642.3.3052",ActionParticipantFunction,Action Participant Function,"The function performed by the participant for the action.","StructureDefinition/protocol","hl7.fhir.r5.core"
http://hl7.org/fhir/ValueSet/action-participant-type,5.0.0,draft,"2.16.840.1.113883.4.642.3.794,2.16.840.1.113883.4.642.3.811",ActionParticipantType,Action Participant Type,"The type of participant for the action.","StructureDefinition/protocol","hl7.fhir.r5.core"
http://hl7.org/fhir/ValueSet/action-precheck-behavior,5.0.0,draft,"2.16.840.1.113883.4.642.3.788,2.16.840.1.113883.4.642.3.805",ActionPrecheckBehavior,Action Precheck Behavior,"Defines selection frequency behavior for an action or group.","StructureDefinition/protocol","hl7.fhir.r5.core"
http://hl7.org/fhir/ValueSet/action-reason-code,5.0.0,draft,"2.16.840.1.113883.4.642.3.3053",ActionReasonCode,Action Reason Code,"Provides examples of reasons for actions to be performed.","StructureDefinition/protocol","hl7.fhir.r5.core"
http://hl7.org/fhir/ValueSet/action-relationship-type,5.0.0,draft,"2.16.840.1.113883.4.642.3.796,2.16.840.1.113883.4.642.3.813",ActionRelationshipType,Action Relationship Type,"Defines the types of relationships between actions.","StructureDefinition/protocol","hl7.fhir.r5.core"
http://hl7.org/fhir/ValueSet/action-required-behavior,5.0.0,draft,"2.16.840.1.113883.4.642.3.786,2.16.840.1.113883.4.642.3.803",ActionRequiredBehavior,Action Required Behavior,"Defines expectations around whether an action or action group is required.","StructureDefinition/protocol","hl7.fhir.r5.core"
http://hl7.org/fhir/ValueSet/action-selection-behavior,5.0.0,draft,"2.16.840.1.113883.4.642.3.784,2.16.840.1.113883.4.642.3.801",ActionSelectionBehavior,Action Selection Behavior,"Defines selection behavior of a group.","StructureDefinition/protocol","hl7.fhir.r5.core"
http://hl7.org/fhir/ValueSet/action-type,5.0.0,draft,"2.16.840.1.113883.4.642.3.809,2.16.840.1.113883.4.642.3.792",ActionType,Action Type,"The type of action to be performed.","StructureDefinition/protocol","THO"
http://hl7.org/fhir/ValueSet/additional-instruction-codes,5.0.0,draft,"2.16.840.1.113883.4.642.3.95",SNOMEDCTAdditionalDosageInstructions,SNOMED CT Additional Dosage Instructions,"This value set includes all SNOMED CT Additional Dosage Instructions.","StructureDefinition/prescription-item","SCT"
http://hl7.org/fhir/ValueSet/administration-method-codes,5.0.0,draft,"2.16.840.1.113883.4.642.3.90,2.16.840.1.113883.4.642.3.97",SNOMEDCTAdministrationMethodCodes,SNOMED CT Administration Method Codes,"This value set includes some method codes from SNOMED CT - provided as an exemplar","StructureDefinition/prescription-item,StructureDefinition/administration-report","SCT"
http://hl7.org/fhir/ValueSet/administration-subpotent-reason,5.0.0,draft,"2.16.840.1.113883.4.642.3.3128",MedicationAdministrationSubpotentReason,MedicationAdministration Subpotent Reason,"MedicationAdministration Subpotent Reason","StructureDefinition/administration-report","hl7.fhir.r5.core"
http://hl7.org/fhir/ValueSet/administrative-gender,5.0.0,active,"2.16.840.1.113883.4.642.3.1",AdministrativeGender,AdministrativeGender,"The gender of a person used for administrative purposes.","StructureDefinition/oncology-patient,StructureDefinition/oncology-practitioner","hl7.fhir.r5.core"
http://hl7.org/fhir/ValueSet/all-languages,5.0.0,active,"2.16.840.1.113883.4.642.3.21",AllLanguages,All Languages,"This value set includes all possible codes from BCP-47 (see http://tools.ietf.org/html/bcp47)","StructureDefinition/prescription,StructureDefinition/prescription-item,StructureDefinition/additional-information,StructureDefinition/Medical-liability-unit,StructureDefinition/protocol,StructureDefinition/oncology-patient,StructureDefinition/oncology-practitioner,StructureDefinition/Stay,StructureDefinition/oncology-medication,StructureDefinition/administration-report,StructureDefinition/associated-device,StructureDefinition/accomodation-unit","hl7.terminology.r5"
http://hl7.org/fhir/ValueSet/approach-site-codes,5.0.0,draft,"2.16.840.1.113883.4.642.3.346",SNOMEDCTAnatomicalStructureAdministrationSites,SNOMED CT Anatomical Structure for Administration Site Codes,"This value set includes Anatomical Structure codes from SNOMED CT - provided as an exemplar.","StructureDefinition/prescription-item,StructureDefinition/administration-report","SCT"
http://hl7.org/fhir/ValueSet/body-site,5.0.0,draft,"2.16.840.1.113883.4.642.3.653,2.16.840.1.113883.4.642.2.78,2.16.840.1.113883.4.642.3.141",SNOMEDCTBodyStructures,SNOMED CT Body Structures,"This value set includes all codes from [SNOMED CT](http://snomed.info/sct) where concept is-a 442083009 (Anatomical or acquired body site (body structure)).","StructureDefinition/additional-information","SCT"
http://hl7.org/fhir/ValueSet/care-plan-activity-performed,5.0.0,draft,"2.16.840.1.113883.4.642.3.3000",CarePlanActivityPerformed,Care Plan Activity Performed,"Example codes indicating the care plan activity that was performed. Note that these are in no way complete and might not even be appropriate for some uses.","StructureDefinition/prescription","SCT"
http://hl7.org/fhir/ValueSet/care-plan-category,5.0.0,draft,"2.16.840.1.113883.4.642.3.136,2.16.840.1.113883.4.642.2.67,2.16.840.1.113883.4.642.3.148",CarePlanCategory,Care Plan Category,"Example codes indicating the category a care plan falls within.  Note that these are in no way complete and might not even be appropriate for some uses.","StructureDefinition/prescription","SCT"
http://hl7.org/fhir/ValueSet/care-plan-intent,5.0.0,draft,"2.16.840.1.113883.4.642.3.150,2.16.840.1.113883.4.642.3.141",CarePlanIntent,Care Plan Intent,"Codes indicating the degree of authority/intentionality associated with a care plan.","StructureDefinition/prescription","hl7.fhir.r5.core"
http://hl7.org/fhir/ValueSet/clinical-findings,5.0.0,draft,"2.16.840.1.113883.4.642.3.232,2.16.840.1.113883.4.642.3.227,2.16.840.1.113883.4.642.2.115",SNOMEDCTClinicalFindings,SNOMED CT Clinical Findings,"This value set includes all the ""Clinical finding"" [SNOMED CT](http://snomed.info/sct) codes - concepts where concept is-a 404684003 (Clinical finding (finding)).","StructureDefinition/prescription,StructureDefinition/protocol","SCT"
http://hl7.org/fhir/ValueSet/condition-code,5.0.0,draft,"2.16.840.1.113883.4.642.3.161,2.16.840.1.113883.4.642.2.72,2.16.840.1.113883.4.642.3.152",ConditionProblemDiagnosisCodes,Condition/Problem/Diagnosis Codes,"Example value set for Condition/Problem/Diagnosis codes.","StructureDefinition/prescription-item,StructureDefinition/protocol,StructureDefinition/Stay","SCT"
http://hl7.org/fhir/ValueSet/data-absent-reason,5.0.0,active,"2.16.840.1.113883.4.642.3.5",DataAbsentReason,Data Absent Reason,"Used to specify why the normally expected content of the data element is missing.","StructureDefinition/additional-information","THO"
http://hl7.org/fhir/ValueSet/days-of-week,5.0.0,active,"2.16.840.1.113883.4.642.3.512,2.16.840.1.113883.4.642.2.302,2.16.840.1.113883.4.642.3.506",DaysOfWeek,Days Of Week,"The days of the week.","StructureDefinition/prescription-item","hl7.fhir.r5.core"
http://hl7.org/fhir/ValueSet/definition-topic,5.0.0,draft,"2.16.840.1.113883.4.642.3.794,2.16.840.1.113883.4.642.3.777",DefinitionTopic,Definition Topic,"High-level categorization of the definition, used for searching, sorting, and filtering.","StructureDefinition/protocol","THO"
http://hl7.org/fhir/ValueSet/device-correctiveactionscope,5.0.0,active,"2.16.840.1.113883.4.642.3.3041",DeviceCorrectiveActionScope,Device Corrective Action Scope,"Device - Corrective action scope","StructureDefinition/associated-device","hl7.fhir.r5.core"
http://hl7.org/fhir/ValueSet/device-nametype,5.0.0,draft,"2.16.840.1.113883.4.642.3.1083",DeviceNameType,Device Name Type,"The type of name the device is referred by.","StructureDefinition/associated-device","hl7.fhir.r5.core"
http://hl7.org/fhir/ValueSet/device-productidentifierinudi,5.0.0,active,"2.16.840.1.113883.4.642.3.3039",DeviceProductionIdentifierInUDI,Device Production Identifier In UDI,"Device Production Identifier in UDI","StructureDefinition/associated-device","hl7.fhir.r5.core"
http://hl7.org/fhir/ValueSet/device-property-type,5.0.0,draft,"2.16.840.1.113883.4.642.3.3195",DeviceType,Device Property Type,"Codes used to identify medical devices. Includes concepts from SNOMED CT (http://www.snomed.org/) where concept is-a 49062001 (Device)  and is provided as a suggestive example.","StructureDefinition/associated-device","SCT,hl7.terminology.r5,Other"
http://hl7.org/fhir/ValueSet/device-safety,5.0.0,draft,"2.16.840.1.113883.4.642.3.213,2.16.840.1.113883.4.642.3.893",DeviceSafety,Device Safety,"Codes used to identify medical devices safety characteristics. These codes are taken from the [NCI Thesaurus](https://ncit.nci.nih.gov/ncitbrowser/pages/home.jsf) and are provided here as a suggestive example.","StructureDefinition/associated-device","Other"
http://hl7.org/fhir/ValueSet/device-specification-category,5.0.0,draft,"2.16.840.1.113883.4.642.3.3197",DeviceSpecificationCategory,Device Specification Category,"The kind of standards used by the device.","StructureDefinition/associated-device","hl7.fhir.r5.core"
http://hl7.org/fhir/ValueSet/device-specification-type,5.0.0,draft,"2.16.840.1.113883.4.642.3.3204",DeviceSpecificationType,Device Specification Type,"The type or specification of a standard that devices can adhere to","StructureDefinition/associated-device","hl7.terminology.r5"
http://hl7.org/fhir/ValueSet/device-type,5.0.0,draft,"2.16.840.1.113883.4.642.3.1376",DeviceType,Device Type,"Codes used to identify medical devices. Includes concepts from SNOMED CT (http://www.snomed.org/) where concept is-a 49062001 (Device)  and is provided as a suggestive example.","StructureDefinition/associated-device","SCT,hl7.terminology.r5,Other"
http://hl7.org/fhir/ValueSet/devicedefinition-regulatory-identifier-type,5.0.0,active,"2.16.840.1.113883.4.642.3.3311",DeviceDefinitionRegulatoryIdentifierType,Device Definition Regulatory Identifier Type,"Regulatory Identifier type","StructureDefinition/associated-device","hl7.fhir.r5.core"
http://hl7.org/fhir/ValueSet/devicedefinition-relationtype,5.0.0,active,"2.16.840.1.113883.4.642.3.3040",DeviceDefinitionRelationType,Device Definition Relation Type,"Description Needed Here","StructureDefinition/associated-device","hl7.fhir.r5.core"
http://hl7.org/fhir/ValueSet/encounter-admit-source,5.0.0,draft,"2.16.840.1.113883.4.642.3.257,2.16.840.1.113883.4.642.2.144,2.16.840.1.113883.4.642.3.252",AdmitSource,Admit Source,"This value set defines a set of codes that can be used to indicate from where the patient came in.","StructureDefinition/Stay","THO"
http://hl7.org/fhir/ValueSet/encounter-diagnosis-use,5.0.0,draft,"2.16.840.1.113883.4.642.4.3321",EncounterDiagnosisUse,Encounter Diagnosis Use,"What a specific Encounter/EpisodeOfCare `diagnosis.condition` is to be used for.","StructureDefinition/Stay","hl7.fhir.r5.core"
http://hl7.org/fhir/ValueSet/encounter-diet,5.0.0,draft,"2.16.840.1.113883.4.642.3.255,2.16.840.1.113883.4.642.2.142,2.16.840.1.113883.4.642.3.250",EncounterDiet,Diet,"This value set defines a set of codes that can be used to indicate dietary preferences or restrictions a patient may have.","StructureDefinition/Stay","THO"
http://hl7.org/fhir/ValueSet/encounter-discharge-disposition,5.0.0,draft,"2.16.840.1.113883.4.642.3.254,2.16.840.1.113883.4.642.2.145,2.16.840.1.113883.4.642.3.259",DischargeDisposition,Discharge Disposition,"This value set defines a set of codes that can be used to where the patient left the hospital.","StructureDefinition/Stay","THO"
http://hl7.org/fhir/ValueSet/encounter-location-status,5.0.0,draft,"2.16.840.1.113883.4.642.3.257,2.16.840.1.113883.4.642.2.147,2.16.840.1.113883.4.642.3.262",EncounterLocationStatus,Encounter Location Status,"The status of the location.","StructureDefinition/Stay","hl7.fhir.r5.core"
http://hl7.org/fhir/ValueSet/encounter-participant-type,5.0.0,draft,"2.16.840.1.113883.4.642.3.245,2.16.840.1.113883.4.642.2.139,2.16.840.1.113883.4.642.3.250",ParticipantType,Participant Type,"This value set defines a set of codes that can be used to indicate how an individual participates in an encounter.","StructureDefinition/Stay","THO (V3),THO"
http://hl7.org/fhir/ValueSet/encounter-reason,5.0.0,draft,"2.16.840.1.113883.4.642.3.256,2.16.840.1.113883.4.642.2.146,2.16.840.1.113883.4.642.3.261",EncounterReasonCodes,Encounter Reason Codes,"This examples value set defines the set of codes that can be used to indicate reasons for an encounter.","StructureDefinition/Stay","SCT"
http://hl7.org/fhir/ValueSet/encounter-reason-use,5.0.0,draft,"2.16.840.1.113883.4.642.4.3320",EncounterReasonUse,Encounter Reason Use,"What a specific Encounter/EpisodeOfCare `reason.value` is to be used for.","StructureDefinition/Stay","hl7.fhir.r5.core"
http://hl7.org/fhir/ValueSet/encounter-special-arrangements,5.0.0,draft,"2.16.840.1.113883.4.642.3.248,2.16.840.1.113883.4.642.2.141,2.16.840.1.113883.4.642.3.253",SpecialArrangements,Special Arrangements,"This value set defines a set of codes that can be used to indicate the kinds of special arrangements in place for a patients visit.","StructureDefinition/Stay","THO"
http://hl7.org/fhir/ValueSet/encounter-special-courtesy,5.0.0,draft,"2.16.840.1.113883.4.642.3.247,2.16.840.1.113883.4.642.3.252,2.16.840.1.113883.4.642.2.140",SpecialCourtesy,Special Courtesy,"This value set defines a set of codes that can be used to indicate special courtesies provided to the patient.","StructureDefinition/Stay","THO (V3)"
http://hl7.org/fhir/ValueSet/encounter-status,5.0.0,draft,"2.16.840.1.113883.4.642.3.246,2.16.840.1.113883.4.642.3.241",EncounterStatus,Encounter Status,"Current state of the encounter.","StructureDefinition/Stay","hl7.fhir.r5.core"
http://hl7.org/fhir/ValueSet/encounter-subject-status,5.0.0,draft,"2.16.840.1.113883.4.642.3.3159",EncounterSubjectStatus,Encounter Subject Status,"This example value set defines a set of codes that can be used to indicate the status of the subject within the encounter","StructureDefinition/Stay","THO"
http://hl7.org/fhir/ValueSet/encounter-type,5.0.0,draft,"2.16.840.1.113883.4.642.3.243,2.16.840.1.113883.4.642.3.248,2.16.840.1.113883.4.642.2.137",EncounterType,Encounter Type,"This example value set defines a set of codes that can be used to indicate the type of encounter: a specific code indicating type of service provided.","StructureDefinition/Stay","THO"
http://hl7.org/fhir/ValueSet/event-timing,5.0.0,active,"2.16.840.1.113883.4.642.3.75",EventTiming,EventTiming,"Real-world event relating to the schedule.","StructureDefinition/prescription-item","THO (V3),hl7.fhir.r5.core"
http://hl7.org/fhir/ValueSet/goal-category,5.0.0,draft,"2.16.840.1.113883.4.642.2.411,2.16.840.1.113883.4.642.3.270,2.16.840.1.113883.4.642.3.275",GoalCategory,Goal Category,"Example codes for grouping goals to use for filtering or presentation.","StructureDefinition/protocol","THO"
http://hl7.org/fhir/ValueSet/goal-priority,5.0.0,draft,"2.16.840.1.113883.4.642.3.268,2.16.840.1.113883.4.642.3.273,2.16.840.1.113883.4.642.2.151",GoalPriority,Goal Priority,"Indicates the level of importance associated with reaching or sustaining a goal.","StructureDefinition/protocol","THO"
http://hl7.org/fhir/ValueSet/goal-start-event,5.0.0,draft,"2.16.840.1.113883.4.642.2.413,2.16.840.1.113883.4.642.3.279,2.16.840.1.113883.4.642.3.274",GoalStartEvent,Goal Start Event,"Identifies types of events that might trigger the start of a goal.","StructureDefinition/protocol","SCT"
http://hl7.org/fhir/ValueSet/identifier-type,5.0.0,active,"2.16.840.1.113883.4.642.3.45",IdentifierTypeCodes,Identifier Type Codes,"A coded type for an identifier that can be used to determine which identifier to use for a specific purpose.","StructureDefinition/prescription-item,StructureDefinition/oncology-patient,StructureDefinition/oncology-practitioner,StructureDefinition/Stay,StructureDefinition/oncology-medication,StructureDefinition/administration-report","THO (V2)"
http://hl7.org/fhir/ValueSet/identifier-use,5.0.0,active,"2.16.840.1.113883.4.642.3.57",IdentifierUse,IdentifierUse,"Identifies the purpose for this identifier, if known .","StructureDefinition/prescription-item,StructureDefinition/oncology-patient,StructureDefinition/oncology-practitioner,StructureDefinition/Stay,StructureDefinition/oncology-medication,StructureDefinition/administration-report","hl7.fhir.r5.core"
http://hl7.org/fhir/ValueSet/jurisdiction,5.0.0,draft,"2.16.840.1.113883.4.642.3.48",JurisdictionValueSet,Jurisdiction ValueSet,"This value set defines a base set of codes for country, country subdivision and region    for indicating where a resource is intended to be used.             Note: The codes for countries and country subdivisions are taken from    [ISO 3166](https://www.iso.org/iso-3166-country-codes.html)    while the codes for ""supra-national"" regions are from    [UN Standard country or area codes for statistical use (M49)](http://unstats.un.org/unsd/methods/m49/m49.htm).","StructureDefinition/protocol","hl7.terminology.r5,Other"
http://hl7.org/fhir/ValueSet/languages,5.0.0,active,"2.16.840.1.113883.4.642.3.891,2.16.840.1.113883.4.642.3.20",CommonLanguages,Common Languages,"This value set includes common codes from BCP-47 (see http://tools.ietf.org/html/bcp47)","StructureDefinition/prescription,StructureDefinition/prescription-item,StructureDefinition/additional-information,StructureDefinition/Medical-liability-unit,StructureDefinition/protocol,StructureDefinition/oncology-patient,StructureDefinition/oncology-practitioner,StructureDefinition/Stay,StructureDefinition/oncology-medication,StructureDefinition/administration-report,StructureDefinition/associated-device,StructureDefinition/accomodation-unit","hl7.terminology.r5"
http://hl7.org/fhir/ValueSet/link-type,5.0.0,active,"2.16.840.1.113883.4.642.2.234,2.16.840.1.113883.4.642.3.423,2.16.840.1.113883.4.642.3.412",LinkType,Link Type,"The type of link between this Patient resource and another Patient/RelatedPerson resource.","StructureDefinition/oncology-patient","hl7.fhir.r5.core"
http://hl7.org/fhir/ValueSet/location-characteristic,5.0.0,draft,"2.16.840.1.113883.4.642.3.3079",LocationCharacteristic,Location Characteristic,"Example Set of Location Characteristics","StructureDefinition/accomodation-unit","hl7.fhir.r5.core"
http://hl7.org/fhir/ValueSet/location-form,5.0.0,draft,"2.16.840.1.113883.4.642.3.328",LocationForm,Location Form,"This example value set defines a set of codes that can be used to indicate the physical form of the Location.","StructureDefinition/Stay,StructureDefinition/accomodation-unit","THO"
http://hl7.org/fhir/ValueSet/location-mode,5.0.0,draft,"2.16.840.1.113883.4.642.3.321,2.16.840.1.113883.4.642.2.181,2.16.840.1.113883.4.642.3.330",LocationMode,Location Mode,"Indicates whether a resource instance represents a specific location or a class of locations.","StructureDefinition/accomodation-unit","hl7.fhir.r5.core"
http://hl7.org/fhir/ValueSet/location-status,5.0.0,draft,"2.16.840.1.113883.4.642.3.323,2.16.840.1.113883.4.642.3.332,2.16.840.1.113883.4.642.2.182",LocationStatus,Location Status,"Indicates whether the location is still in use.","StructureDefinition/accomodation-unit","hl7.fhir.r5.core"
http://hl7.org/fhir/ValueSet/marital-status,5.0.0,active,"2.16.840.1.113883.4.642.3.29",MaritalStatusCodes,Marital Status Codes,"This value set defines the set of codes that can be used to indicate the marital status of a person.","StructureDefinition/oncology-patient","THO (V3)"
http://hl7.org/fhir/ValueSet/med-admin-perform-function,5.0.0,draft,"2.16.840.1.113883.4.642.3.349",MedicationAdministrationPerformerFunctionCodes,MedicationAdministration Performer Function Codes,"MedicationAdministration Performer Function Codes","StructureDefinition/administration-report","THO"
http://hl7.org/fhir/ValueSet/medication-admin-location,5.0.0,draft,"2.16.840.1.113883.4.642.3.3127",MedicationAdministrationLocationCodes,MedicationAdministration Location Codes,"MedicationAdministration Location Codes","StructureDefinition/administration-report","THO"
http://hl7.org/fhir/ValueSet/medication-admin-status,5.0.0,draft,"2.16.840.1.113883.4.642.2.186,2.16.840.1.113883.4.642.3.340,2.16.840.1.113883.4.642.3.330",MedicationAdministrationStatusCodes,MedicationAdministration Status Codes,"MedicationAdministration Status Codes","StructureDefinition/administration-report","hl7.fhir.r5.core"
http://hl7.org/fhir/ValueSet/medication-as-needed-reason,5.0.0,draft,"2.16.840.1.113883.4.642.3.89,2.16.840.1.113883.4.642.3.96",SNOMEDCTMedicationAsNeededReasonCodes,SNOMED CT Medication As Needed Reason Codes,"This value set includes all clinical findings from SNOMED CT - provided as an exemplar value set.","StructureDefinition/prescription-item,StructureDefinition/protocol","SCT"
http://hl7.org/fhir/ValueSet/medication-codes,5.0.0,draft,"2.16.840.1.113883.4.642.3.375,2.16.840.1.113883.4.642.2.199,2.16.840.1.113883.4.642.3.360",SNOMEDCTMedicationCodes,SNOMED CT Medication Codes,"This value set includes all drug or medicament substance codes and all pharmaceutical/biologic products from SNOMED CT - provided as an exemplar value set.","StructureDefinition/prescription-item,StructureDefinition/oncology-medication,StructureDefinition/administration-report","SCT"
http://hl7.org/fhir/ValueSet/medication-dose-aid,5.0.0,draft,"2.16.840.1.113883.4.642.3.3241",MedicationDoseAids,Medication Dose Aids,"Medication Dose Aids","StructureDefinition/prescription-item","hl7.fhir.r5.core"
http://hl7.org/fhir/ValueSet/medication-form-codes,5.0.0,draft,"2.16.840.1.113883.4.642.3.359,2.16.840.1.113883.4.642.2.198,2.16.840.1.113883.4.642.3.374",SNOMEDCTFormCodes,SNOMED CT Form Codes,"This value set includes all dose form codes from SNOMED CT - provided as an exemplar.","StructureDefinition/oncology-medication","SCT"
http://hl7.org/fhir/ValueSet/medication-ingredientstrength,5.0.0,draft,"2.16.840.1.113883.4.642.3.1953",MedicationIngredientStrengthCodes,Medication Ingredient Strength Codes,"Medication Ingredient Strength Codes","StructureDefinition/oncology-medication","hl7.fhir.r5.core"
http://hl7.org/fhir/ValueSet/medication-intended-performer-role,5.0.0,draft,"2.16.840.1.113883.4.642.3.1979",MedicationIntendedPerformerRole,Medication Intended Performer Role,"Medication Intended Performer Role","StructureDefinition/prescription-item","hl7.fhir.r5.core"
http://hl7.org/fhir/ValueSet/medication-status,5.0.0,draft,"2.16.840.1.113883.4.642.3.376,2.16.840.1.113883.4.642.3.363",MedicationStatusCodes,Medication Status Codes,"Medication Status Codes","StructureDefinition/oncology-medication","hl7.fhir.r5.core"
http://hl7.org/fhir/ValueSet/medicationrequest-admin-location,5.0.0,draft,"2.16.840.1.113883.4.642.3.3242",MedicationRequestAdministrationLocationCodes,medicationRequest Administration Location Codes,"MedicationRequest Administration Location Codes","StructureDefinition/prescription-item","THO"
http://hl7.org/fhir/ValueSet/medicationrequest-course-of-therapy,5.0.0,draft,"2.16.840.1.113883.4.642.3.1326",MedicationRequestCourseOfTherapyCodes,medicationRequest Course of Therapy Codes,"MedicationRequest Course of Therapy Codes","StructureDefinition/prescription-item","THO"
http://hl7.org/fhir/ValueSet/medicationrequest-intent,5.0.0,draft,"2.16.840.1.113883.4.642.3.1321",MedicationRequestIntent,medicationRequest Intent,"MedicationRequest Intent Codes","StructureDefinition/prescription-item","hl7.fhir.r5.core"
http://hl7.org/fhir/ValueSet/medicationrequest-status,5.0.0,draft,"2.16.840.1.113883.4.642.3.1320",MedicationrequestStatus,medicationrequest Status,"MedicationRequest Status Codes","StructureDefinition/prescription-item","hl7.fhir.r5.core"
http://hl7.org/fhir/ValueSet/medicationrequest-status-reason,5.0.0,draft,"2.16.840.1.113883.4.642.3.1324",MedicationRequestStatusReasonCodes,medicationRequest Status Reason Codes,"MedicationRequest Status Reason Codes","StructureDefinition/prescription-item","THO"
http://hl7.org/fhir/ValueSet/name-use,5.0.0,active,"2.16.840.1.113883.4.642.3.65",NameUse,NameUse,"The use of a human name.","StructureDefinition/oncology-patient","hl7.fhir.r5.core"
http://hl7.org/fhir/ValueSet/observation-category,5.0.0,draft,"2.16.840.1.113883.4.642.3.403,2.16.840.1.113883.4.642.2.222,2.16.840.1.113883.4.642.3.392",ObservationCategoryCodes,Observation Category Codes,"Observation Category codes.","StructureDefinition/additional-information","THO"
